{
  "id": "cr-56-amax",
  "name": "CR-56 AMAX",
  "class": "AR",
  "game": "bo6",
  "weapon_type": "AR",
  "in_warzone": true,
  "source": "codmunity-api (data-mined)",
  "data_version": "S4Reloaded_2026-07-08_codmunity",
  "note": "Off-Meta BO6 AR (Galil-Reboot). Universelle Slots = BO6-Pool.",
  "base": {
    "rpm": 632,
    "mag": 30,
    "reload_s": 2.767,
    "ads_ms": 250,
    "sprint_to_fire_ms": 180,
    "velocity_ms": 840,
    "move_speed": 4.7,
    "crouch_move_speed": 2.3,
    "ads_move_speed": 3,
    "sprint_speed": 6.2,
    "gun_kick": 32,
    "vert_recoil": 57.82,
    "horiz_recoil": 12.09,
    "hipfire_max": 7.5
  },
  "damage": [
    {
      "head": 49,
      "neck": 40,
      "chest": 40,
      "stomach": 37,
      "upperarm": 40,
      "lowerarm": 40,
      "upperleg": 37,
      "lowerleg": 37,
      "dropoff": 0,
      "base_rpm": 632,
      "final_rpm": 632,
      "rpm_mod": 1.0
    },
    {
      "head": 41,
      "neck": 34,
      "chest": 34,
      "stomach": 31,
      "upperarm": 34,
      "lowerarm": 34,
      "upperleg": 31,
      "lowerleg": 31,
      "dropoff": 38,
      "base_rpm": 632,
      "final_rpm": 632,
      "rpm_mod": 1.0
    },
    {
      "head": 37,
      "neck": 30,
      "chest": 30,
      "stomach": 28,
      "upperarm": 30,
      "lowerarm": 30,
      "upperleg": 28,
      "lowerleg": 28,
      "dropoff": 53,
      "base_rpm": 632,
      "final_rpm": 632,
      "rpm_mod": 1.0
    }
  ],
  "slots": {
    "BARREL": [
      {
        "name": "Gain-Twist Barrel",
        "unlock_level": 7,
        "mods": {
          "bv_mod": 1.5
        }
      },
      {
        "name": "Reinforced Barrel",
        "unlock_level": 29,
        "mods": {
          "bv_mod": 1.25,
          "range_mod": 1.2489
        }
      },
      {
        "name": "Long Barrel",
        "unlock_level": 16,
        "mods": {
          "range_mod": 1.4489
        }
      },
      {
        "name": "CHF Barrel",
        "unlock_level": 23,
        "mods": {
          "gun_kick_mod": 1.58,
          "horiz_recoil_mod": 1.4
        }
      },
      {
        "name": "Short Barrel",
        "unlock_level": 39
      }
    ],
    "FIRE MODS": [
      {
        "name": "Recoil Springs",
        "unlock_level": 27,
        "mods": {
          "gun_kick_mod": 0.87,
          "horiz_recoil_mod": 0.87
        }
      },
      {
        "name": "Rapid Fire",
        "unlock_level": 35,
        "mods": {
          "bv_mod": 0.85,
          "gun_kick_mod": 1.16,
          "horiz_recoil_mod": 1.15,
          "rpm_mod": 1.09
        }
      },
      {
        "name": "7.62x39mm Overpressured",
        "unlock_level": 28,
        "mods": {
          "bv_mod": 1.2
        }
      },
      {
        "name": "7.62x39mm FMJ",
        "unlock_level": 6
      }
    ],
    "LASER": [
      {
        "name": "Steady Aim Laser",
        "unlock_level": 17,
        "mods": {
          "hipfire_max_mod": 0.78
        }
      },
      {
        "name": "Strelok Laser",
        "unlock_level": 8
      },
      {
        "name": "Fast Motion Laser",
        "unlock_level": 22
      },
      {
        "name": "Tactical Laser",
        "unlock_level": 26
      },
      {
        "name": "Target Laser",
        "unlock_level": 30
      }
    ],
    "MAGAZINE": [
      {
        "name": "M-67 10-R Mags",
        "unlock_level": 4,
        "mods": {
          "ads_mod": 0.9,
          "ads_movement_mod": 1.13,
          "bv_mod": 1.22,
          "gun_kick_mod": 0.9,
          "horiz_recoil_mod": 2.77,
          "mag_size_mod": -20,
          "reload_mod": 0.82,
          "rpm_mod": 0.5
        }
      },
      {
        "name": "Extended Mag I",
        "unlock_level": 9,
        "mods": {
          "mag_size_mod": 15,
          "reload_mod": 1.1
        }
      },
      {
        "name": "Extended Mag II",
        "unlock_level": 33,
        "mods": {
          "ads_mod": 1.07,
          "mag_size_mod": 30,
          "reload_mod": 1.2,
          "stf_mod": 1.11
        }
      },
      {
        "name": "Flip Mag",
        "unlock_level": 15,
        "mods": {
          "ads_mod": 0.95,
          "reload_mod": 0.87,
          "stf_mod": 0.94
        }
      }
    ],
    "MUZZLE": [
      {
        "name": "Monolithic Suppressor",
        "unlock_level": "Armory Unlock",
        "mods": {
          "ads_mod": 1.2,
          "bv_mod": 1.2,
          "range_mod": 1.1
        }
      },
      {
        "name": "Compensator",
        "unlock_level": 19,
        "mods": {
          "gun_kick_mod": 0.69
        }
      },
      {
        "name": "Ported Compensator",
        "unlock_level": 31,
        "mods": {
          "gun_kick_mod": 0.78
        }
      },
      {
        "name": "Suppressor",
        "unlock_level": 13
      },
      {
        "name": "Muzzle Brake",
        "unlock_level": 25
      }
    ],
    "REAR GRIP": [
      {
        "name": "CQB Grip",
        "unlock_level": 36,
        "mods": {
          "stf_mod": 0.63
        }
      },
      {
        "name": "Ergonomic Grip",
        "unlock_level": 42,
        "mods": {
          "ads_mod": 0.82
        }
      },
      {
        "name": "Quickdraw Grip",
        "unlock_level": 11,
        "mods": {
          "ads_mod": 0.71
        }
      },
      {
        "name": "Commando Grip",
        "unlock_level": 21,
        "mods": {
          "ads_mod": 0.87,
          "stf_mod": 0.79
        }
      },
      {
        "name": "Assault Grip",
        "unlock_level": 5,
        "mods": {
          "stf_mod": 0.5
        }
      }
    ],
    "STOCK": [
      {
        "name": "Combat Stock",
        "unlock_level": 41,
        "mods": {
          "ads_movement_mod": 1.14
        }
      },
      {
        "name": "Heavy Stock",
        "unlock_level": 14
      },
      {
        "name": "Light Stock",
        "unlock_level": 3,
        "mods": {
          "crouch_movement_mod": 1.44,
          "movement_mod": 1.24
        }
      },
      {
        "name": "Balanced Stock",
        "unlock_level": 34,
        "mods": {
          "ads_movement_mod": 1.12,
          "crouch_movement_mod": 1.22,
          "movement_mod": 1.12
        }
      },
      {
        "name": "Infiltrator Stock",
        "unlock_level": 38,
        "mods": {
          "ads_movement_mod": 1.22
        }
      }
    ],
    "UNDERBARREL": [
      {
        "name": "Vertical Foregrip",
        "unlock_level": 10,
        "mods": {
          "gun_kick_mod": 0.96,
          "horiz_recoil_mod": 0.58
        }
      },
      {
        "name": "Ranger Foregrip",
        "unlock_level": 32,
        "mods": {
          "gun_kick_mod": 0.98,
          "horiz_recoil_mod": 0.78,
          "sprint_mod": 1.08
        }
      },
      {
        "name": "Precision Foregrip",
        "unlock_level": 24,
        "mods": {
          "gun_kick_mod": 0.98,
          "horiz_recoil_mod": 0.78
        }
      },
      {
        "name": "G-Grip",
        "unlock_level": "Armory Unlock",
        "mods": {
          "gun_kick_mod": 0.98,
          "horiz_recoil_mod": 0.8
        }
      },
      {
        "name": "Lightweight Foregrip",
        "unlock_level": 2
      },
      {
        "name": "Launcher - Smoke",
        "unlock_level": 12
      },
      {
        "name": "Marksman Foregrip",
        "unlock_level": 18
      },
      {
        "name": "Launcher - Standard",
        "unlock_level": 20
      },
      {
        "name": "Launcher - Drill Charge",
        "unlock_level": 37
      },
      {
        "name": "Launcher - High Explosive",
        "unlock_level": 40
      }
    ]
  }
}
