{
  "id": "knife",
  "name": "Knife",
  "class": "Melee",
  "game": "bo7",
  "weapon_type": "Melee",
  "in_warzone": true,
  "source": "codmunity-api (data-mined)",
  "data_version": "S4Reloaded_2026-07-08_codmunity",
  "unlock_level": 1,
  "note": "Hoher Schaden, kurze Reichweite, schnelle Angriffsgeschwindigkeit. Max Weapon-Level 30.",
  "base": {},
  "slots": {
    "MUZZLE": [
      {
        "name": "Monolithic Suppressor",
        "unlock_level": "Armory Unlock"
      }
    ]
  },
  "subclass": "Knife",
  "unlock": "Launch (Standard, Level 1)"
}
