{
  "id": "feng-82",
  "name": "Feng 82",
  "class": "LMG",
  "game": "bo6",
  "weapon_type": "LMG",
  "in_warzone": true,
  "source": "codmunity-api (data-mined)",
  "data_version": "S4Reloaded_2026-07-08_codmunity",
  "unlock_level": 7,
  "note": "Off-Meta BO6 LMG (5.56 NATO, 461 RPM, 30-round, Belt-Fed-Option). reload roh '3400 s' -> 3.4. Universelle Slots = BO6-Pool. Weapon-spez: MUZZLE/BARREL/MAGAZINE/FIRE MODS.",
  "base": {
    "rpm": 461,
    "mag": 30,
    "reload_s": 3.4,
    "ads_ms": 350,
    "sprint_to_fire_ms": 210,
    "velocity_ms": 880,
    "move_speed": 4.7,
    "crouch_move_speed": 1.9,
    "ads_move_speed": 2.7,
    "sprint_speed": 6.1,
    "gun_kick": 15.93,
    "vert_recoil": 64.85,
    "horiz_recoil": 11.61,
    "hipfire_max": 10
  },
  "damage": [
    {
      "head": 54,
      "neck": 45,
      "chest": 45,
      "stomach": 45,
      "upperarm": 45,
      "lowerarm": 45,
      "upperleg": 40,
      "lowerleg": 40,
      "dropoff": 0,
      "base_rpm": 461,
      "final_rpm": 461,
      "rpm_mod": 1.0
    },
    {
      "head": 50,
      "neck": 42,
      "chest": 42,
      "stomach": 42,
      "upperarm": 42,
      "lowerarm": 42,
      "upperleg": 37,
      "lowerleg": 37,
      "dropoff": 76.2,
      "base_rpm": 461,
      "final_rpm": 461,
      "rpm_mod": 1.0
    }
  ],
  "slots": {
    "BARREL": [
      {
        "name": "Gain-Twist Barrel",
        "mods": {
          "bv_mod": 1.3
        }
      },
      {
        "name": "Reinforced Barrel",
        "mods": {
          "bv_mod": 1.15,
          "range_mod": 1.1502
        }
      },
      {
        "name": "Long Barrel",
        "mods": {
          "range_mod": 1.3005
        }
      },
      {
        "name": "Short Barrel"
      },
      {
        "name": "CHF Barrel",
        "mods": {
          "gun_kick_mod": 1.45,
          "horiz_recoil_mod": 1.25
        }
      }
    ],
    "FIRE MODS": [
      {
        "name": "5.56 NATO Overpressured",
        "mods": {
          "bv_mod": 1.2
        }
      },
      {
        "name": "5.56 NATO FMJ"
      },
      {
        "name": "Recoil Springs",
        "mods": {
          "gun_kick_mod": 0.92,
          "horiz_recoil_mod": 0.92
        }
      },
      {
        "name": "Rapid Fire",
        "mods": {
          "bv_mod": 0.88,
          "gun_kick_mod": 1.15,
          "horiz_recoil_mod": 1.2,
          "range_mod": 0,
          "rpm_mod": 1.11
        }
      }
    ],
    "LASER": [
      {
        "name": "Fast Motion Laser"
      },
      {
        "name": "Steady Aim Laser",
        "mods": {
          "hipfire_max_mod": 0.7
        }
      },
      {
        "name": "Strelok Laser"
      },
      {
        "name": "Tactical Laser"
      },
      {
        "name": "Target Laser"
      }
    ],
    "MAGAZINE": [
      {
        "name": "Extended Mag I",
        "mods": {
          "mag_size_mod": 20,
          "reload_mod": 1.21
        }
      },
      {
        "name": "Extended Mag II",
        "mods": {
          "ads_mod": 1.05,
          "mag_size_mod": 45,
          "reload_mod": 1.45,
          "stf_mod": 1.1
        }
      },
      {
        "name": "Fast Mag I",
        "mods": {
          "ads_mod": 0.6,
          "mag_size_mod": -10,
          "reload_mod": 0.69,
          "stf_mod": 0.5
        }
      },
      {
        "name": "Belt-Fed",
        "mods": {
          "mag_size_mod": 180
        }
      }
    ],
    "MUZZLE": [
      {
        "name": "Suppressor"
      },
      {
        "name": "Compensator",
        "mods": {
          "gun_kick_mod": 0.71
        }
      },
      {
        "name": "Muzzle Brake"
      },
      {
        "name": "Ported Compensator",
        "mods": {
          "gun_kick_mod": 0.8
        }
      },
      {
        "name": "Monolithic Suppressor",
        "mods": {
          "ads_mod": 1.15,
          "bv_mod": 1.2,
          "range_mod": 1.1
        }
      }
    ],
    "REAR GRIP": [
      {
        "name": "Commando Grip",
        "mods": {
          "ads_mod": 0.88,
          "stf_mod": 0.8
        }
      },
      {
        "name": "Assault Grip",
        "mods": {
          "stf_mod": 0.61
        }
      },
      {
        "name": "CQB Grip"
      },
      {
        "name": "Ergonomic Grip",
        "mods": {
          "ads_mod": 0.86
        }
      },
      {
        "name": "Quickdraw Grip",
        "mods": {
          "ads_mod": 0.78
        }
      },
      {
        "name": "CBQ Grip",
        "mods": {
          "stf_mod": 0.71
        }
      }
    ],
    "STOCK": [
      {
        "name": "Balanced Stock",
        "mods": {
          "ads_movement_mod": 1.1,
          "crouch_movement_mod": 1.21,
          "movement_mod": 1.11
        }
      },
      {
        "name": "Combat Stock",
        "mods": {
          "ads_movement_mod": 1.12
        }
      },
      {
        "name": "Infiltrator Stock",
        "mods": {
          "ads_movement_mod": 1.19
        }
      },
      {
        "name": "Heavy Stock"
      },
      {
        "name": "No Stock",
        "mods": {
          "crouch_movement_mod": 1.42,
          "movement_mod": 1.22
        }
      }
    ],
    "UNDERBARREL": [
      {
        "name": "Lightweight Foregrip"
      },
      {
        "name": "Marksman Foregrip"
      },
      {
        "name": "Precision Foregrip",
        "mods": {
          "horiz_recoil_mod": 0.83
        }
      },
      {
        "name": "Weighted Foregrip"
      },
      {
        "name": "Vertical Foregrip"
      },
      {
        "name": "Crossbar",
        "mods": {
          "ads_mod": 0.87,
          "ads_movement_mod": 1.19,
          "gun_kick_mod": 1.1,
          "vert_recoil_mod": 1.1
        }
      },
      {
        "name": "Ranger Foregrip",
        "mods": {
          "horiz_recoil_mod": 0.83,
          "sprint_mod": 1.07
        }
      }
    ]
  }
}
