{
  "id": "abr-a1",
  "name": "ABR A1",
  "class": "AR",
  "game": "bo6",
  "weapon_type": "AR",
  "in_warzone": true,
  "source": "codmunity-api (data-mined)",
  "data_version": "S4Reloaded_2026-07-08_codmunity",
  "unlock_level": 5,
  "note": "Off-Meta BO6 AR (3-Round-Burst AUG, 2x). Universelle Slots (OPTIC/UNDERBARREL/COMB/STOCK/LASER) = BO6-Pool (ref lc10.json).",
  "base": {
    "rpm": 495,
    "mag": 30,
    "reload_s": 3.267,
    "ads_ms": 260,
    "sprint_to_fire_ms": 170,
    "velocity_ms": 830,
    "move_speed": 4.9,
    "crouch_move_speed": 2.4,
    "ads_move_speed": 3.3,
    "sprint_speed": 6.3,
    "gun_kick": 37.9,
    "vert_recoil": 42.58,
    "horiz_recoil": 13.41,
    "hipfire_max": 7.7
  },
  "damage": [
    {
      "head": 51,
      "neck": 43,
      "chest": 43,
      "stomach": 38,
      "upperarm": 43,
      "lowerarm": 43,
      "upperleg": 38,
      "lowerleg": 38,
      "dropoff": 0,
      "base_rpm": 495,
      "final_rpm": 495,
      "rpm_mod": 1.0
    },
    {
      "head": 49,
      "neck": 41,
      "chest": 41,
      "stomach": 36,
      "upperarm": 41,
      "lowerarm": 41,
      "upperleg": 36,
      "lowerleg": 36,
      "dropoff": 36,
      "base_rpm": 495,
      "final_rpm": 495,
      "rpm_mod": 1.0
    },
    {
      "head": 44,
      "neck": 37,
      "chest": 37,
      "stomach": 33,
      "upperarm": 37,
      "lowerarm": 37,
      "upperleg": 33,
      "lowerleg": 33,
      "dropoff": 48,
      "base_rpm": 495,
      "final_rpm": 495,
      "rpm_mod": 1.0
    }
  ],
  "slots": {
    "BARREL": [
      {
        "name": "Reinforced Barrel",
        "mods": {
          "bv_mod": 1.2,
          "range_mod": 1.2013
        }
      },
      {
        "name": "Gain-Twist Barrel",
        "mods": {
          "bv_mod": 1.45
        }
      },
      {
        "name": "Long Barrel",
        "mods": {
          "range_mod": 1.4508
        }
      },
      {
        "name": "CHF Barrel",
        "mods": {
          "gun_kick_mod": 1.3,
          "horiz_recoil_mod": 1.1,
          "vert_recoil_mod": 1.3
        }
      },
      {
        "name": "Short Barrel"
      }
    ],
    "COMB": [
      {
        "name": "Combat Riser",
        "mods": {
          "stf_mod": 0.47
        }
      },
      {
        "name": "Quickdraw Riser",
        "mods": {
          "ads_mod": 0.69
        }
      },
      {
        "name": "CQB Riser",
        "mods": {
          "stf_mod": 0.65
        }
      },
      {
        "name": "Commando Riser",
        "mods": {
          "ads_mod": 0.86,
          "stf_mod": 0.76
        }
      },
      {
        "name": "Ergonomic Riser",
        "mods": {
          "ads_mod": 0.82
        }
      }
    ],
    "FIRE MODS": [
      {
        "name": "Rapid Fire",
        "mods": {
          "gun_kick_mod": 0.88,
          "horiz_recoil_mod": 0.88,
          "rpm_mod": 1.38,
          "vert_recoil_mod": 0.88
        }
      },
      {
        "name": "Recoil Springs",
        "mods": {
          "gun_kick_mod": 0.85,
          "horiz_recoil_mod": 0.85,
          "vert_recoil_mod": 0.85
        }
      },
      {
        "name": "5.56 NATO Overpressured",
        "mods": {
          "bv_mod": 1.2
        }
      },
      {
        "name": "5.56 NATO FMJ"
      }
    ],
    "LASER": [
      {
        "name": "Steady Aim Laser",
        "mods": {
          "hipfire_max_mod": 0.8
        }
      },
      {
        "name": "Strelok Laser"
      },
      {
        "name": "Tactical Laser"
      },
      {
        "name": "Fast Motion Laser"
      },
      {
        "name": "Target Laser"
      }
    ],
    "MAGAZINE": [
      {
        "name": "Extended Mag I",
        "mods": {
          "mag_size_mod": 15,
          "reload_mod": 0.96
        }
      },
      {
        "name": "Flip Mag",
        "mods": {
          "reload_mod": 0.88
        }
      },
      {
        "name": "Extended Mag II",
        "mods": {
          "ads_mod": 1.08,
          "mag_size_mod": 30,
          "reload_mod": 1.15,
          "stf_mod": 1.12
        }
      },
      {
        "name": "Fast Mag I",
        "mods": {
          "ads_mod": 0.9,
          "mag_size_mod": -6,
          "reload_mod": 0.75,
          "stf_mod": 0.88
        }
      }
    ],
    "MUZZLE": [
      {
        "name": "Muzzle Brake"
      },
      {
        "name": "Ported Compensator",
        "mods": {
          "gun_kick_mod": 0.75,
          "vert_recoil_mod": 0.75
        }
      },
      {
        "name": "Compensator",
        "mods": {
          "gun_kick_mod": 0.65,
          "vert_recoil_mod": 0.65
        }
      },
      {
        "name": "Monolithic Suppressor",
        "mods": {
          "bv_mod": 1.2,
          "range_mod": 1.1
        }
      },
      {
        "name": "Suppressor"
      }
    ],
    "STOCK": [
      {
        "name": "Light Pad",
        "mods": {
          "crouch_movement_mod": 1.4,
          "movement_mod": 1.22
        }
      },
      {
        "name": "Combat Pad",
        "mods": {
          "ads_movement_mod": 1.12
        }
      },
      {
        "name": "Balanced Pad",
        "mods": {
          "ads_movement_mod": 1.1,
          "crouch_movement_mod": 1.2,
          "movement_mod": 1.11
        }
      },
      {
        "name": "Infiltrator Pad",
        "mods": {
          "ads_movement_mod": 1.2
        }
      },
      {
        "name": "Heavy Pad"
      }
    ],
    "UNDERBARREL": [
      {
        "name": "Precision Foregrip",
        "mods": {
          "horiz_recoil_mod": 0.8
        }
      },
      {
        "name": "Ranger Foregrip",
        "mods": {
          "horiz_recoil_mod": 0.8,
          "sprint_mod": 1.07
        }
      },
      {
        "name": "Vertical Foregrip",
        "mods": {
          "horiz_recoil_mod": 0.6
        }
      },
      {
        "name": "G-Grip",
        "mods": {
          "horiz_recoil_mod": 0.8
        }
      },
      {
        "name": "Launcher - High Explosive"
      },
      {
        "name": "Lightweight Foregrip"
      },
      {
        "name": "Marksman Foregrip"
      },
      {
        "name": "Launcher - Standard"
      },
      {
        "name": "Launcher - Smoke"
      },
      {
        "name": "Launcher - Drill Charge"
      },
      {
        "name": "Crossbow"
      }
    ]
  }
}
