{
  "id": "ppsh-41",
  "name": "PPSh-41",
  "class": "SMG",
  "game": "bo6",
  "weapon_type": "SMG",
  "in_warzone": true,
  "source": "codmunity-api (data-mined)",
  "data_version": "S4Reloaded_2026-07-08_codmunity",
  "unlock_level": 55,
  "note": "Off-Meta BO6 SMG (7.62x25 Tokarev, 952 RPM, 32-round). reload roh '3060 s' -> 3.06. Universelle Slots = BO6-Pool.",
  "base": {
    "rpm": 952,
    "mag": 32,
    "reload_s": 3.06,
    "ads_ms": 175,
    "sprint_to_fire_ms": 115,
    "velocity_ms": 530,
    "move_speed": 5.1,
    "crouch_move_speed": 2.4,
    "ads_move_speed": 3.8,
    "sprint_speed": 6.5,
    "gun_kick": 35.1,
    "vert_recoil": 38.12,
    "horiz_recoil": 19.21,
    "hipfire_max": 7.85
  },
  "damage": [
    {
      "head": 35,
      "neck": 28,
      "chest": 28,
      "stomach": 28,
      "upperarm": 28,
      "lowerarm": 28,
      "upperleg": 28,
      "lowerleg": 28,
      "dropoff": 0,
      "base_rpm": 952,
      "final_rpm": 952,
      "rpm_mod": 1.0
    },
    {
      "head": 30,
      "neck": 24,
      "chest": 24,
      "stomach": 24,
      "upperarm": 24,
      "lowerarm": 24,
      "upperleg": 24,
      "lowerleg": 24,
      "dropoff": 11,
      "base_rpm": 952,
      "final_rpm": 952,
      "rpm_mod": 1.0
    },
    {
      "head": 24,
      "neck": 19,
      "chest": 19,
      "stomach": 19,
      "upperarm": 19,
      "lowerarm": 19,
      "upperleg": 19,
      "lowerleg": 19,
      "dropoff": 18,
      "base_rpm": 952,
      "final_rpm": 952,
      "rpm_mod": 1.0
    }
  ],
  "slots": {
    "BARREL": [
      {
        "name": "Reinforced Barrel",
        "mods": {
          "bv_mod": 1.3,
          "range_mod": 1.1513
        }
      },
      {
        "name": "Gain-Twist Barrel",
        "mods": {
          "bv_mod": 1.55
        }
      },
      {
        "name": "Long Barrel",
        "mods": {
          "range_mod": 1.3025
        }
      },
      {
        "name": "Short Barrel"
      },
      {
        "name": "CHF Barrel",
        "mods": {
          "gun_kick_mod": 1.42,
          "horiz_recoil_mod": 1.2
        }
      }
    ],
    "FIRE MODS": [
      {
        "name": "Rapid Fire",
        "mods": {
          "bv_mod": 0.8,
          "gun_kick_mod": 1.16,
          "horiz_recoil_mod": 1.2,
          "range_mod": 0,
          "rpm_mod": 1.12
        }
      },
      {
        "name": "Recoil Springs",
        "mods": {
          "gun_kick_mod": 0.84,
          "horiz_recoil_mod": 0.84
        }
      },
      {
        "name": "7.62x25mm Tokarev Overpressured",
        "mods": {
          "bv_mod": 1.2
        }
      },
      {
        "name": "7.62x25mm Tokarev FMJ"
      }
    ],
    "LASER": [
      {
        "name": "Fast Motion Laser"
      },
      {
        "name": "Steady Aim Laser",
        "mods": {
          "hipfire_max_mod": 0.8
        }
      },
      {
        "name": "Strelok Laser"
      },
      {
        "name": "Tactical Laser"
      },
      {
        "name": "Target Laser"
      }
    ],
    "MAGAZINE": [
      {
        "name": "Extended Mag I",
        "mods": {
          "mag_size_mod": 13,
          "reload_mod": 1.14
        }
      },
      {
        "name": "Extended Mag II",
        "mods": {
          "ads_mod": 1.1,
          "mag_size_mod": 23,
          "reload_mod": 1.22,
          "stf_mod": 1.16
        }
      },
      {
        "name": "Flip Mag",
        "mods": {
          "reload_mod": 0.87
        }
      },
      {
        "name": "Fast Mag I",
        "mods": {
          "ads_mod": 0.92,
          "reload_mod": 0.82,
          "stf_mod": 0.92
        }
      },
      {
        "name": "PPSh-41 Helical Magazine",
        "mods": {
          "ads_movement_mod": 1.07,
          "horiz_recoil_mod": 0.8,
          "mag_size_mod": 168,
          "vert_recoil_mod": 0.8
        }
      }
    ],
    "MUZZLE": [
      {
        "name": "Suppressor"
      },
      {
        "name": "Compensator",
        "mods": {
          "gun_kick_mod": 0.7
        }
      },
      {
        "name": "Muzzle Brake"
      },
      {
        "name": "Ported Compensator",
        "mods": {
          "gun_kick_mod": 0.8
        }
      },
      {
        "name": "Monolithic Suppressor",
        "mods": {
          "ads_mod": 1.28,
          "bv_mod": 1.2,
          "range_mod": 1.1
        }
      }
    ],
    "STOCK": [
      {
        "name": "Ergonomic Stock",
        "mods": {
          "ads_movement_mod": 1.11
        }
      },
      {
        "name": "Combat Stock",
        "mods": {
          "stf_mod": 0.8
        }
      },
      {
        "name": "Agility Stock",
        "mods": {
          "ads_mod": 0.84,
          "ads_movement_mod": 1.11
        }
      },
      {
        "name": "Quickdraw Stock",
        "mods": {
          "ads_mod": 0.56
        }
      },
      {
        "name": "Light Stock",
        "mods": {
          "crouch_movement_mod": 1.39,
          "movement_mod": 1.23
        }
      },
      {
        "name": "Infiltrator Stock",
        "mods": {
          "ads_movement_mod": 1.22
        }
      },
      {
        "name": "Balanced Stock",
        "mods": {
          "crouch_movement_mod": 1.21,
          "movement_mod": 1.14,
          "stf_mod": 0.87
        }
      }
    ],
    "UNDERBARREL": [
      {
        "name": "Lightweight Foregrip"
      },
      {
        "name": "Marksman Foregrip"
      },
      {
        "name": "Precision Foregrip",
        "mods": {
          "gun_kick_mod": 0.98,
          "horiz_recoil_mod": 0.8
        }
      },
      {
        "name": "Ranger Foregrip",
        "mods": {
          "gun_kick_mod": 0.98,
          "horiz_recoil_mod": 0.8,
          "sprint_mod": 1.08
        }
      },
      {
        "name": "Vertical Foregrip"
      },
      {
        "name": "Weighted Foregrip"
      },
      {
        "name": "Launcher - Standard"
      },
      {
        "name": "Launcher - High Explosive"
      },
      {
        "name": "Crossbar"
      },
      {
        "name": "Lightweight Handguard"
      },
      {
        "name": "Weighted Handguard"
      },
      {
        "name": "Precision Handguard"
      },
      {
        "name": "Ranger Handguard"
      },
      {
        "name": "Marksman Handguard"
      },
      {
        "name": "Launcher - Smoke"
      },
      {
        "name": "Launcher - Drill Charge"
      },
      {
        "name": "G-Grip",
        "mods": {
          "gun_kick_mod": 0.98,
          "horiz_recoil_mod": 0.8
        }
      }
    ]
  }
}
