{
  "id": "kilo-141",
  "name": "Kilo 141",
  "class": "AR",
  "game": "bo6",
  "weapon_type": "AR",
  "in_warzone": true,
  "source": "codmunity-api (data-mined)",
  "data_version": "S4Reloaded_2026-07-08_codmunity",
  "note": "Off-Meta AR (5.56 NATO, 750 RPM, MW2019-Ursprung; TGD nutzt BO6-Attachment-System). reload roh '2800 s' -> 2.8.",
  "base": {
    "rpm": 750,
    "mag": 30,
    "reload_s": 2.38,
    "ads_ms": 260,
    "sprint_to_fire_ms": 170,
    "velocity_ms": 800,
    "move_speed": 4.8,
    "crouch_move_speed": 2.5,
    "ads_move_speed": 3.2,
    "sprint_speed": 7.3,
    "gun_kick": 20.9,
    "vert_recoil": 35.16,
    "horiz_recoil": 5,
    "hipfire_max": 7.5
  },
  "damage": [
    {
      "head": 36,
      "neck": 31,
      "chest": 31,
      "stomach": 28,
      "upperarm": 31,
      "lowerarm": 31,
      "upperleg": 28,
      "lowerleg": 28,
      "dropoff": 0,
      "base_rpm": 750,
      "final_rpm": 750,
      "rpm_mod": 1.0
    },
    {
      "head": 28,
      "neck": 25,
      "chest": 25,
      "stomach": 22,
      "upperarm": 25,
      "lowerarm": 25,
      "upperleg": 22,
      "lowerleg": 22,
      "dropoff": 36,
      "base_rpm": 750,
      "final_rpm": 750,
      "rpm_mod": 1.0
    },
    {
      "head": 24,
      "neck": 21,
      "chest": 21,
      "stomach": 19,
      "upperarm": 21,
      "lowerarm": 21,
      "upperleg": 19,
      "lowerleg": 19,
      "dropoff": 48,
      "base_rpm": 750,
      "final_rpm": 750,
      "rpm_mod": 1.0
    }
  ],
  "slots": {
    "BARREL": [
      {
        "name": "CHF Barrel",
        "unlock_level": 20,
        "mods": {
          "gun_kick_mod": 1.5,
          "horiz_recoil_mod": 1.2,
          "vert_recoil_mod": 1.5
        }
      },
      {
        "name": "Reinforced Barrel",
        "unlock_level": 33,
        "mods": {
          "bv_mod": 1.25,
          "range_mod": 1.2222
        }
      },
      {
        "name": "Gain-Twist Barrel",
        "unlock_level": 2,
        "mods": {
          "bv_mod": 1.5
        }
      },
      {
        "name": "Long Barrel",
        "unlock_level": 10,
        "mods": {
          "range_mod": 1.4444
        }
      },
      {
        "name": "Short Barrel",
        "unlock_level": 39
      }
    ],
    "FIRE MODS": [
      {
        "name": "Recoil Springs",
        "unlock_level": 17,
        "mods": {
          "gun_kick_mod": 0.84,
          "horiz_recoil_mod": 0.84,
          "vert_recoil_mod": 0.84
        }
      },
      {
        "name": "Rapid Fire",
        "unlock_level": 35,
        "mods": {
          "bv_mod": 0.85,
          "gun_kick_mod": 1.15,
          "horiz_recoil_mod": 1.15,
          "rpm_mod": 1.1,
          "vert_recoil_mod": 1.15
        }
      },
      {
        "name": "5.56 NATO Overpressured",
        "unlock_level": 28,
        "mods": {
          "bv_mod": 1.2
        }
      },
      {
        "name": "5.56 NATO FMJ",
        "unlock_level": 12
      }
    ],
    "LASER": [
      {
        "name": "Steady Aim Laser",
        "unlock_level": 22,
        "mods": {
          "hipfire_max_mod": 0.75
        }
      },
      {
        "name": "Strelok Laser",
        "unlock_level": 11
      },
      {
        "name": "Tactical Laser",
        "unlock_level": 18
      },
      {
        "name": "Fast Motion Laser",
        "unlock_level": 27
      },
      {
        "name": "Target Laser",
        "unlock_level": 32
      }
    ],
    "MAGAZINE": [
      {
        "name": "Extended Mag II",
        "unlock_level": 19,
        "mods": {
          "ads_mod": 1.08,
          "mag_size_mod": 30,
          "stf_mod": 1.12
        }
      },
      {
        "name": "Flip Mag",
        "unlock_level": 4,
        "mods": {
          "ads_mod": 0.94,
          "reload_mod": 0.64
        }
      },
      {
        "name": "Extended Mag I",
        "unlock_level": 9,
        "mods": {
          "mag_size_mod": 20
        }
      },
      {
        "name": "Extended Mag III",
        "unlock_level": 29,
        "mods": {
          "ads_mod": 1.42,
          "ads_movement_mod": 0.94,
          "mag_size_mod": 40,
          "reload_mod": 1.18,
          "stf_mod": 1.29
        }
      }
    ],
    "MUZZLE": [
      {
        "name": "Compensator",
        "unlock_level": 21,
        "mods": {
          "gun_kick_mod": 0.63,
          "vert_recoil_mod": 0.62
        }
      },
      {
        "name": "Ported Compensator",
        "unlock_level": 34,
        "mods": {
          "gun_kick_mod": 0.75,
          "vert_recoil_mod": 0.75
        }
      },
      {
        "name": "Monolithic Suppressor",
        "unlock_level": "Armory Unlock",
        "mods": {
          "ads_mod": 1.21,
          "bv_mod": 1.2,
          "range_mod": 1.1
        }
      },
      {
        "name": "Suppressor",
        "unlock_level": 7
      },
      {
        "name": "Muzzle Brake",
        "unlock_level": 26
      }
    ],
    "REAR GRIP": [
      {
        "name": "Commando Grip",
        "unlock_level": 23,
        "mods": {
          "ads_mod": 0.87,
          "stf_mod": 0.76
        }
      },
      {
        "name": "Assault Grip",
        "unlock_level": 14,
        "mods": {
          "stf_mod": 0.44
        }
      },
      {
        "name": "CQB Grip",
        "unlock_level": 40,
        "mods": {
          "stf_mod": 0.59
        }
      },
      {
        "name": "Ergonomic Grip",
        "unlock_level": 36,
        "mods": {
          "ads_mod": 0.81
        }
      },
      {
        "name": "Quickdraw Grip",
        "unlock_level": 6,
        "mods": {
          "ads_mod": 0.68
        }
      }
    ],
    "STOCK": [
      {
        "name": "Balanced Stock",
        "unlock_level": 30,
        "mods": {
          "ads_movement_mod": 1.12,
          "crouch_movement_mod": 1.2,
          "movement_mod": 1.12
        }
      },
      {
        "name": "Heavy Stock",
        "unlock_level": 5
      },
      {
        "name": "No Stock",
        "unlock_level": 13,
        "mods": {
          "crouch_movement_mod": 1.4,
          "movement_mod": 1.24
        }
      },
      {
        "name": "Combat Stock",
        "unlock_level": 37,
        "mods": {
          "ads_movement_mod": 1.13
        }
      },
      {
        "name": "Infiltrator Stock",
        "unlock_level": 42,
        "mods": {
          "ads_movement_mod": 1.22
        }
      }
    ],
    "UNDERBARREL": [
      {
        "name": "Precision Foregrip",
        "unlock_level": 25,
        "mods": {
          "horiz_recoil_mod": 0.76
        }
      },
      {
        "name": "Ranger Foregrip",
        "unlock_level": 31,
        "mods": {
          "horiz_recoil_mod": 0.76,
          "sprint_mod": 1.07
        }
      },
      {
        "name": "G-Grip",
        "unlock_level": "Armory Unlock",
        "mods": {
          "horiz_recoil_mod": 0.8
        }
      },
      {
        "name": "Vertical Foregrip",
        "unlock_level": 3,
        "mods": {
          "horiz_recoil_mod": 0.56
        }
      },
      {
        "name": "Lightweight Foregrip",
        "unlock_level": 8
      },
      {
        "name": "Launcher - High Explosive",
        "unlock_level": 15
      },
      {
        "name": "Marksman Foregrip",
        "unlock_level": 16
      },
      {
        "name": "Launcher - Standard",
        "unlock_level": 24
      },
      {
        "name": "Launcher - Smoke",
        "unlock_level": 38
      },
      {
        "name": "Launcher - Drill Charge",
        "unlock_level": 41
      }
    ]
  }
}
