{
  "id": "swordfish-a1",
  "name": "Swordfish A1",
  "class": "Battle Rifle",
  "game": "bo7",
  "weapon_type": "MR",
  "in_warzone": true,
  "source": "codmunity-api (data-mined)",
  "data_version": "S4Reloaded_2026-07-08_codmunity",
  "note": "Off-Meta BO7 Battle Rifle (5.56 NATO, 488 RPM, 36-round, 5-Rnd-Burst). BO7-branded (Redwell/VAS/Bowen/Angler). Black-Ops-Layout: OPTIC/UNDERBARREL/REAR GRIP/STOCK/LASER universell. Weapon-spez: MUZZLE/BARREL/MAGAZINE/FIRE MODS.",
  "base": {
    "rpm": 488,
    "mag": 36,
    "reload_s": 2.622,
    "ads_ms": 270,
    "sprint_to_fire_ms": 240,
    "velocity_ms": 915,
    "move_speed": 4.4,
    "crouch_move_speed": 2.3,
    "ads_move_speed": 2.8,
    "sprint_speed": 6.9,
    "gun_kick": 17.8,
    "vert_recoil": 19.95,
    "horiz_recoil": 1.68,
    "hipfire_max": 8.5
  },
  "damage": [
    {
      "head": 51,
      "neck": 45,
      "chest": 45,
      "stomach": 40,
      "upperarm": 45,
      "lowerarm": 45,
      "upperleg": 40,
      "lowerleg": 40,
      "dropoff": 0,
      "base_rpm": 488,
      "final_rpm": 488,
      "rpm_mod": 1.0
    },
    {
      "head": 43,
      "neck": 38,
      "chest": 38,
      "stomach": 34,
      "upperarm": 38,
      "lowerarm": 38,
      "upperleg": 34,
      "lowerleg": 34,
      "dropoff": 42,
      "base_rpm": 488,
      "final_rpm": 488,
      "rpm_mod": 1.0
    }
  ],
  "slots": {
    "BARREL": [
      {
        "name": "13\" EAM Volare Barrel",
        "mods": {
          "ads_mod": 0.95,
          "stf_mod": 0.93
        }
      },
      {
        "name": "15.1\" Spatha Barrel",
        "mods": {
          "ads_mod": 1.03,
          "bv_mod": 1.08,
          "range_mod": 1.0857
        }
      },
      {
        "name": "16.5\" Gar-XL Barrel",
        "mods": {
          "ads_movement_mod": 0.96,
          "bv_mod": 1.18,
          "horiz_recoil_mod": 0.95
        }
      },
      {
        "name": "15.9\" Bowen Melville Barrel",
        "mods": {
          "ads_mod": 1.1,
          "ads_movement_mod": 0.93,
          "gun_kick_mod": 0.85,
          "horiz_recoil_mod": 0.85,
          "stf_mod": 1.08,
          "vert_recoil_mod": 0.85
        }
      },
      {
        "name": "17\" Angler Barrel",
        "mods": {
          "ads_mod": 1.05,
          "range_mod": 1.1429
        }
      },
      {
        "name": "16.5\" Gar-xL Barrel"
      }
    ],
    "FIRE MODS": [
      {
        "name": "MFS Penta Burst Mod",
        "mods": {
          "ads_mod": 1.06,
          "bv_mod": 0.94,
          "gun_kick_mod": 1.4,
          "horiz_recoil_mod": 1.08,
          "mag_size_mod": 24,
          "reload_mod": 1.21,
          "rpm_mod": 1.15,
          "stf_mod": 1.07,
          "vert_recoil_mod": 1.4
        }
      },
      {
        "name": "Bolt Carrier Group",
        "mods": {
          "bv_mod": 0.85,
          "gun_kick_mod": 1.2,
          "horiz_recoil_mod": 1.2,
          "range_mod": 0.8,
          "rpm_mod": 1.05,
          "vert_recoil_mod": 1.2
        }
      },
      {
        "name": "5.56 NATO Overpressured",
        "mods": {
          "bv_mod": 1.15
        }
      },
      {
        "name": "Recoil Sync Unit",
        "mods": {
          "gun_kick_mod": 0.92,
          "horiz_recoil_mod": 0.92,
          "vert_recoil_mod": 0.92
        }
      },
      {
        "name": "5.56 NATO FMJ"
      }
    ],
    "LASER": [
      {
        "name": "Convergence Box Laser",
        "mods": {
          "hipfire_max_mod": 0.8
        }
      },
      {
        "name": "1mW Instinct Laser Array",
        "mods": {
          "ads_mod": 0.96,
          "stf_mod": 0.93
        }
      },
      {
        "name": "3mW Motion Strike Laser"
      },
      {
        "name": "5mW Lockstep Laser"
      },
      {
        "name": "2mW Adaptive Tactical Laser"
      }
    ],
    "MAGAZINE": [
      {
        "name": "Dorado Extended Mag",
        "mods": {
          "mag_size_mod": 12
        }
      },
      {
        "name": "Mini-Pearl Fast Mag",
        "mods": {
          "ads_mod": 0.96,
          "mag_size_mod": -4,
          "reload_mod": 0.7,
          "stf_mod": 0.96
        }
      },
      {
        "name": "VAS Samson Drum",
        "mods": {
          "ads_mod": 1.08,
          "ads_movement_mod": 0.91,
          "crouch_movement_mod": 0.94,
          "mag_size_mod": 24,
          "movement_mod": 0.93,
          "reload_mod": 1.12,
          "sprint_mod": 0.96,
          "stf_mod": 1.1
        }
      },
      {
        "name": "RO-C Speed Mag",
        "mods": {
          "reload_mod": 0.86
        }
      },
      {
        "name": "R0-G Speed Mag"
      }
    ],
    "MUZZLE": [
      {
        "name": "Redwell Shade-X Suppressor",
        "mods": {
          "bv_mod": 0.87,
          "gun_kick_mod": 0.89,
          "horiz_recoil_mod": 0.89,
          "range_mod": 0.8857,
          "vert_recoil_mod": 0.89
        }
      },
      {
        "name": "Monolithic Suppressor",
        "mods": {
          "ads_mod": 1.17,
          "bv_mod": 1.15,
          "range_mod": 1.0571
        }
      },
      {
        "name": "Titan-R 5.56 Compensator",
        "mods": {
          "hipfire_max_mod": 0.8
        }
      },
      {
        "name": "Redwell 5.56 Compensator",
        "mods": {
          "gun_kick_mod": 0.81,
          "vert_recoil_mod": 0.8
        }
      },
      {
        "name": "RL-5.56 Brake",
        "mods": {
          "gun_kick_mod": 0.9,
          "vert_recoil_mod": 0.9
        }
      },
      {
        "name": "LTI Stentorian Brake",
        "mods": {
          "gun_kick_mod": 1.04,
          "horiz_recoil_mod": 0.9,
          "rpm_mod": 1.02,
          "vert_recoil_mod": 1.04
        }
      },
      {
        "name": "VAS 5.56 Suppressor"
      }
    ],
    "REAR GRIP": [
      {
        "name": "Plenary Grip",
        "mods": {
          "stf_mod": 0.76
        }
      },
      {
        "name": "R1-Splendor Grip",
        "mods": {
          "ads_mod": 0.78
        }
      },
      {
        "name": "Hawker VIC-R Grip",
        "mods": {
          "ads_mod": 0.88
        }
      },
      {
        "name": "Trevally Shock Grip",
        "mods": {
          "gun_kick_mod": 0.89,
          "vert_recoil_mod": 0.88
        }
      },
      {
        "name": "Webbed Pistol Grip",
        "mods": {
          "ads_mod": 1.05,
          "horiz_recoil_mod": 0.89
        }
      }
    ],
    "STOCK": [
      {
        "name": "Bosun Light Stock",
        "mods": {
          "ads_mod": 0.93,
          "ads_movement_mod": 1.26
        }
      },
      {
        "name": "Amber-J Stock",
        "mods": {
          "gun_kick_mod": 0.8,
          "horiz_recoil_mod": 0.8,
          "vert_recoil_mod": 0.8
        }
      },
      {
        "name": "Adept Skiff Stock",
        "mods": {
          "crouch_movement_mod": 1.31,
          "movement_mod": 1.2,
          "sprint_mod": 1.03
        }
      },
      {
        "name": "Narwhal Heavy Stock",
        "mods": {
          "hipfire_max_mod": 0.83
        }
      },
      {
        "name": "Q-Stubb Stock",
        "mods": {
          "ads_mod": 1.07,
          "gun_kick_mod": 0.9,
          "horiz_recoil_mod": 0.9,
          "vert_recoil_mod": 0.9
        }
      }
    ],
    "UNDERBARREL": [
      {
        "name": "Fluxus Underbarrel",
        "mods": {
          "horiz_recoil_mod": 0.85
        }
      },
      {
        "name": "Dart Grip",
        "mods": {
          "ads_movement_mod": 1.14,
          "crouch_movement_mod": 1.09,
          "movement_mod": 1.1
        }
      },
      {
        "name": "Modus-R Underbarrel",
        "mods": {
          "crouch_movement_mod": 1.09,
          "horiz_recoil_mod": 0.92,
          "movement_mod": 1.1,
          "sprint_mod": 1.03
        }
      },
      {
        "name": "Dominium Grip",
        "mods": {
          "horiz_recoil_mod": 0.8
        }
      },
      {
        "name": "Fixus Underbarrel"
      },
      {
        "name": "Aperture-2 Underbarrel"
      }
    ]
  }
}
